Approx Duration (ms),Video Description (Original),Video Title (Original),Video Publish Timestamp
281000,"If you are a student or researcher in any field, you'll eventually run into the need to learn to code. Programming will make you self sufficient, it will teach you how to think, it improves your collaborative skills and it can take your career to new heights. If you want to stay ahead of your peers and relevant in your field, overcome your fears and start coding!",01 - Why do you need to learn programming?,2019-05-05T22:09:40+00:00
394000,"What is programming?
A few programming terms.
What is an IDE?",02 - What is programming?,2019-05-05T22:23:57+00:00
579000,As a coder you need to understand the basics of command prompt. You need not be an expert but you should be able to change folders or run a python file from command line. This video provides a short explanation of command prompt.,03 - What is command prompt?,2019-05-06T23:02:25+00:00
644000,It is very important to understand what a digital image means before you can learn about processing these images. This video provides a short introduction to digital images. Spoiler alert - they are numpy arrays!,04 - What is a digital image?,2019-05-06T23:07:35+00:00
519000,If you are an absolute beginner programmer then you may need a bit of introduction to Python. The video also introduces a few Python terms like integrated development environment (IDE).,05 - What is Python?,2019-05-06T23:14:26+00:00
1145000,"This video provides an overview of various development environments (IDE) and explains Anaconda Spyder interface. It also introduces a few core Python operators. You will also learn about different data types; int, float and str.",06 - Python basics - IDE & operators,2019-05-06T23:28:29+00:00
1214000,"This is a continuation of previous video and introduces logical operators. You will also learn to code your first program using E = mC**2 and F = ma formule. In addition, you will learn how to take input via keyboard (provided by the user) which involves converting data type from string to an integer.",07 - Python basics - logical operators and basic math,2019-05-06T23:37:05+00:00
148000,This video warns you about potential round-off errors in Python.,08 - A warning about round off errors in Python,2019-05-06T23:37:41+00:00
716000,In this video you'll learn about using if and else statements in Python. These are very common statements in many languages.,09 - if else elif statements in Python,2019-05-07T00:01:55+00:00
1284000,"Images are nothing but a list of numbers. Therefore, it is important to understand various types of lists in Python. This video introduces lists, tuples, dictionaries, and numpy arrays.",10 - lists tuples and dictionaries,2019-05-07T00:24:18+00:00
2487000,"Images are multi-dimensional numpy arrays. This video introduces you to numpy arrays, including opening an image and looking at the array values associated with that image.",11 - numpy arrays,2019-05-07T02:00:45+00:00
1007000,Images are multidimensional lists or numpy arrays. This video summarizes information from the previous tutorials on lists and numpy arrays.,12 - Python Recap of lists and numpy arrays,2019-05-07T14:36:39+00:00
1365000,"Loops are used to perform useful tasks over and over until a condition is met. With loops you can repeat a set of statements even on each item in a list, tuple, dictionary or numpy array. This video provides an introduction to loops in Python including, for and while loops.",13 - for and while Loops in Python,2019-05-07T14:43:48+00:00
1298000,"A function in Python enables modularity and makes blocks of your code reusable. print() is a built in function that gets used quite often. As a coder, you can build your own functions in Python. This video introduces you to functions and explains its use with basic image processing examples.",14 - Python Functions,2019-05-07T16:06:54+00:00
1376000,"Functions allow us to modularize the code and make it reusable. But functions do not store any information, for example like variables do. This is solved by object oriented programming where it puts functions and variables together in a class. This video provides an introduction to classes in Python and uses cell positions and distance measurement as an example.",15 - Python Classes,2019-05-07T16:16:13+00:00
1111000,"Digital image processing in Python is mostly done via numpy array manipulation. This video provides a quick overview of digital images, their data types and numpy array manipulation to modify images.",16 - Understanding digital images for Python processing,2019-05-07T22:43:43+00:00
3298000,"There are many ways to reading images in Python. This video explains image reading using popular libraries in Python. It also explains a couple of ways to read non-standard images including Carl Zeiss' CZI and Bioformats' OME-TIFF images.

The code from this video is available at: https://github.com/bnsreenu/python_for_microscopists",17 - Reading images in Python,2019-05-08T20:20:32+00:00
1871000,"Pillow (PIL) is an image manipulation and processing library in Python. This video covers the basics of pillow library using a few examples for image resizing, cropping, and applying them to multiple images.

The code from this video is available at: https://github.com/bnsreenu/python_for_microscopists",18 - Image processing using pillow in Python,2019-05-09T18:17:13+00:00
1634000,"Scipy is a python library that is part of numpy stack. It contains modules for linear algebra, FFT, signal processing and image processing. Scipy is not specifically designed for image processing but it has a few useful tools. This video covers the basic image processing functionality of scipy library in Python.

The code from this video is available at: https://github.com/bnsreenu/python_for_microscopists",19 - image processing using scipy in Python,2019-05-09T23:16:23+00:00
2245000,"Scikit-image is a Python library dedicated towards image processing. This video explains a few useful functions from the scikit-image library including, resize, reshape, edge detectors and segmentation process for a microscopy based assay (wound healing or scratch assay).

The code from this video is available at: https://github.com/bnsreenu/python_for_microscopists",20 - Introduction to image processing using scikit-image in Python,2019-05-13T23:51:16+00:00
1688000,"Scratch assay or Wound healing assay is one of the common assays in biology. It involves segmenting time series images for 'clean' vs cell-filled regions. This task can be very challenging as histogram segmentation does not yield desired results. This video tutorial explains the segmentation process using Entropy filter and Otsu thresholding in Python. It also explains the process of looping through images to analyze and plot the results.

The code from this video is available at: https://github.com/bnsreenu/python_for_microscopists",21 - Scratch assay analysis with just 5 lines code in Python,2019-05-15T01:40:42+00:00
1211000,"A compromise on signal to noise for speed often results in noisy microscope images. These images can be denoised to extract relevant information. There are many choices for denoising algorithms in Python but some are better than others. This video demonstrates a few denoising functions from Sciki-image and numpy libraries.

The code from this video is available at: https://github.com/bnsreenu/python_for_microscopists",22 - Denoising microscope images in Python,2019-05-16T21:18:51+00:00
1452000,"Microscope images are acquired to extract information about a sample. In order to properly quantify the information the images often need to be segmented for various features of interest. This tutorial explains the process of image segmentation in Python using histogram based thresholding. In other words, this video tutorial explains the process of defining grey level ranges for each feature of interest to perform segmentation. The tutorial also covers basic image processing operations in order to clean up the segmented regions.

The code from this video is available at: https://github.com/bnsreenu/python_for_microscopists",23 - Histogram based image segmentation in Python,2019-05-17T16:29:43+00:00
1618000,"Histogram based image segmentation is not possible in many cases. This tutorial explains the use of Random Walker segmentation in Python using a noisy backscattered electron (BSE) image collected from an alloy.

The code from this video is available at: https://github.com/bnsreenu/python_for_microscopists",24 - Random Walker segmentation in Python,2019-05-17T22:10:26+00:00
1210000,"openCV is a library of programming functions mainly aimed at computer vision but also very helpful for processing microscope images. This tutorial explains a few basic operations in openCV to read & resize images and to split & merge channels.

The code from this video is available at: https://github.com/bnsreenu/python_for_microscopists","25 - Reading Images, Splitting Channels, Resizing using openCV in Python",2019-05-20T21:47:26+00:00
1259000,"Cleaning up noise without losing information is important for microscope images (micrographs). This tutorial explains a few ways to perform denoising in openCV. It also explains Canny edge detection, also part of opencv.

The code from this video is available at: https://github.com/bnsreenu/python_for_microscopists",26 - Denoising and edge detection using opencv in Python,2019-05-20T22:12:47+00:00
1232000,"Histogram equalization often makes images easy to threshold and further segment. This tutorial demonstrates the use of Contrast Limited Adaptive Histogram Equalization (CLAHE) and subsequent thresholding using openCV library in Python.

The code from this video is available at: https://github.com/bnsreenu/python_for_microscopists",27 - CLAHE and Thresholding using opencv in Python,2019-05-21T01:56:46+00:00
1231000,"It becomes necessary to cleanup 'noise' after image thresholding. This tutorial explains the use of morphological operators like erosion, dilation and opening to cleanup post-thresholding noise.

The code from this video is available at: https://github.com/bnsreenu/python_for_microscopists",28 - Thresholding and morphological operations using openCV in Python,2019-05-22T00:32:41+00:00
1826000,"Keypoints are points of interest in an image that can be used to compare images and perform tasks such as image alignment and registration. These points can be automatically detected (defined) by the system using algorithms such as SIFT, SURF, and ORB. Some of these algorithms can also define the descriptors to make key points really useful for image processing tasks. This tutorial introduces a few key point detectors and descriptors.

The code from this video is available at: https://github.com/bnsreenu/python_for_microscopists","29 - Key points, detectors and descriptors in openCV",2019-05-25T16:08:40+00:00
2802000,"Image registration is one of the common tasks performed by microscopists working with 3D data sets. There are excellent algorithms available for registration. Homography allows image registration by using descriptors of keypoints generated by SIFT, SURF, ORB or similar keypoint descriptors. This tutorial demonstrates the process using a distorted image and corresponding reference image.

The code from this video is available at: https://github.com/bnsreenu/python_for_microscopists",30 - Image registration using homography in openCV,2019-05-28T22:32:40+00:00
1097000,"Image (data) analysis may require you to save results into a csv file. Or if you would like to perform data analysis in Python you may need to read/import csv files. This tutorial explains a few ways to read and write csv files into and out of Python.

The code from this video is available at: https://github.com/bnsreenu/python_for_microscopists",31 - A few ways to read and write csv files in Python,2019-05-30T17:57:49+00:00
2469000,"Understanding grains in metal alloys is important for quality control and research. Optical and electron microscopes are used to image well-polished alloy surfaces to capture grain structure. Automating the process of grain analysis not only speeds up QC/research but also yields consistent & repeatable results. 

This video tutorial explains the image processing tasks required to generate grain analysis summary and to capture it in a csv file.

The code from this video is available at: https://github.com/bnsreenu/python_for_microscopists",32 - Grain size analysis in Python using a microscope image,2019-05-31T20:33:46+00:00
2328000,"Threshold based segmentation will not yield good results if the features of interest cannot be easily distinguished using the histogram of pixel values. For example, grains in a microscope image (or cells) will not be efficiently separated thus resulting in wrong insights about the sample. 

Watershed assisted segmentation is ideal for these situations. The image can be thresholded first using traditional approach to identify definitely positive and definitely negative regions. Then, watershed algorithm can be used to fill the gaps. This video demonstrates the use of watershed algorithm using a microscope image showing grains and boundaries (same example as previous video in this playlist).

The code from this video is available at: https://github.com/bnsreenu/python_for_microscopists",33 - Grain size analysis in Python using watershed,2019-06-04T15:00:18+00:00
1103000,"This tutorial is an extension of the previous tutorial where grain size analysis was performed using a single image. In this tutorial you will learn 2 ways to apply the grain analysis process to multiple images in a directory. Please remember that there are many ways to handle multiple images but this video shows two easiest approaches, especially for beginner programmers.

The code from this video is available at: https://github.com/bnsreenu/python_for_microscopists",34 - Grain size analysis in Python using watershed - multiple images,2019-06-05T16:56:23+00:00
924000,"This tutorial explains the process of cell nuclei segmentation followed by counting and sizing the nuclei. The results are exported into a csv file for further analysis. The tutorial is a follow up to the previous 3 videos in this playlist where grain segmentation was performed using traditional and watershed segmentation, respectively. The video is dedicated to all biologists who are wasting their valuable research time in doing these task manually!

The code from this video is available at: https://github.com/bnsreenu/python_for_microscopists",35 - Cell Nuclei analysis in Python using watershed segmentation,2019-06-06T22:34:31+00:00
1379000,"Data analysis is an essential step after image processing. While Excel provides an easy interface for data analysis and plotting it does come with a lot of limitations, especially when it comes to handling big data. Pandas library in Python provides great tools for data manipulation and analysis. This tutorial provides an introduction to Pandas and covers the topics of data loading (using a csv file) and basic handling of data.

The code from this video is available at: https://github.com/bnsreenu/python_for_microscopists",36 - Introduction to Pandas - Data reading and handling,2019-06-25T22:29:04+00:00
905000,"This tutorial explains the basic data manipulation tasks using Pandas library in Python. These tasks include editing rows and columns.

The code from this video is available at: https://github.com/bnsreenu/python_for_microscopists",37 - Introduction to Pandas - Data Manipulation,2019-06-25T23:02:58+00:00
1274000,"This tutorial explains data sorting tasks using Pandas library in Python. Sorting and filtering can help you understand and interpret data in a meaningful way.

The code from this video is available at: https://github.com/bnsreenu/python_for_microscopists",38 - Introduction to Pandas - Data Sorting,2019-06-26T22:30:35+00:00
731000,"This tutorial explains data grouping using Pandas library in Python. Grouping can help with better understanding the information contained within the data. For example, if you have bi-modal distribution of cells or grains, grouping them as small & large enables you to better understand the morphology information for each cell/grain type.

The code from this video is available at: https://github.com/bnsreenu/python_for_microscopists",39 - Introduction to Pandas -  Grouping Data,2019-06-26T22:35:54+00:00
906000,Data comes in many forms and encountering missing data is inevitable. Pandas is very flexible when it comes to handling missing data. This tutorial explains ways to check for missing data (a.k.a Null values or NaN) and also demonstrates a couple of ways to handle missing data (delete rows/columns or fill with a meaningful value).,40 - Introduction to Pandas - Dealing with missing (null) data,2019-06-26T22:44:12+00:00
1663000,"Plotting is the best way to communicate information contained in images and other forms of data. Pandas is an excellent library in Python for data analysis and it also contains a few plotting tools (powered by Matplotlib). This tutorial covers the core plotting tools in Pandas library.

The code from this video is available at: https://github.com/bnsreenu/python_for_microscopists",41 - Introduction to Pandas  - Plotting,2019-07-01T16:04:29+00:00
1743000,"Seaborn is a complimentary plotting library to Matplotlib for statistical data visualization. It enhances the visualization capabilities and makes working with Pandas DataFrames easy. This tutorial covers the basics of Seaborn library and goes through a few example plots.

The code from this video is available at: https://github.com/bnsreenu/python_for_microscopists",42 - Introduction to Seaborn Plotting in Python,2019-07-01T16:23:00+00:00
1281000,"A high level explanation of machine learning - for absolute beginners.

The code from this video is available at: https://github.com/bnsreenu/python_for_microscopists",43 - What is machine learning anyway?,2019-07-09T22:11:15+00:00
1016000,"Linear regression is a type of predictive analysis that is used in many fields including sciences, engineering and forecasting. This video explains linear regression and introduces relevant terminology such as least squares, cost function, and gradient descent.

The code from this video is available at: https://github.com/bnsreenu/python_for_microscopists",44 - What is linear regression?,2019-09-13T22:47:39+00:00
1520000,"This is a follow up to the previous video where I explained the theory behind Linear Regression. In this video, I go through the process of using Sci-kit learn in Python to perform Linear Regression on data imported from a csv file.

The code from this video is available at: https://github.com/bnsreenu/python_for_microscopists",45 - Linear regression using Sci-Kit Learn in Python,2019-09-17T18:18:51+00:00
828000,"When you build a model using machine learning or other means it is important to validate it with a test data set. It is important to test the model on data that the algorithm did not use for training purposes. It is also important for the test data set to follow similar probability distribution as the training data set. The easiest way to achieve this is by splitting the data into training and testing data sets. This video tutorial explains this process in Python using Scikit-learn library.

The code from this video is available at: https://github.com/bnsreenu/python_for_microscopists",46 - Splitting data into training and testing sets for machine learning,2019-09-20T23:23:38+00:00
798000,"In the previous video I've explained the concept of linear regression where a single independent variable (X) was used to model the dependent variable (Y). In reality, multiple independent factors (variables) may influence the response. This tutorial explains the use of regression to model single independent variable using multiple dependent variables.

The code from this video is available at: https://github.com/bnsreenu/python_for_microscopists",47 - Multiple Linear Regression with SciKit-Learn in Python,2019-09-24T20:53:10+00:00
827000,"Despite its name, Logistic regression is primarily used for classification type of problems. In other words, it is a statistical method in which there are one or more independent variables that determine an outcome.  Binary logistic regression examples include, sick vs healthy cell, defective vs good part or small vs large particle. This tutorial explains the basics of logistic regression.",48 - What is logistic regression?,2019-09-24T21:02:25+00:00
2316000,"This tutorial explains the few lines to code logistic regression in Python using scikit-learn library.

The code from this video is available at: https://github.com/bnsreenu/python_for_microscopists",49 - Logistic Regression using scikit-learn in Python,2019-09-24T21:23:04+00:00
1015000,"k-means is probably the simplest unsupervised machine learning algorithm that uses clustering techniques to sort data into various clusters (classes). This video tutorial explains the basics of k-means and walks you through the process of coding it in Python.

The code from this video is available at: https://github.com/bnsreenu/python_for_microscopists",50 - What is k-means clustering and how to code it in Python?,2019-09-26T19:27:53+00:00
1097000,k-means is one of the best unsupervised machine learning algorithms. Do you know that it can be used to segment images? This tutorial explains the use of k-means to automatically segment microscope images.,51 - Image Segmentation using K-means,2019-09-27T23:28:18+00:00
1768000,"Gaussian mixture model (GMM) is a type of clustering algorithm that falls under the umbrella of unsupervised machine learning techniques. As the name indicates, GMM models each cluster to a Gaussian distribution with specific mean and variance. It follows the expectation maximization algorithm principles to find the required parameters to model different Gaussians. 

This tutorial explains the basics of GMM and also goes through the process of writing few lines of code to segment a microscope image.

The code from this video is available at: https://github.com/bnsreenu/python_for_microscopists",52 - What is GMM and how to use it for Image segmentation?,2019-09-30T21:40:43+00:00
820000,"Unsupervised machine learning (e.g. k-means, GMM) can be used to segment data into various clusters. But how do you know the optimal number of clusters to divide your data? This video explains the use of AIC / BIC to identify the optimal number of parameters for unsupervised models.

The code from this video is available at: https://github.com/bnsreenu/python_for_microscopists",53  - How to pick optimal number of parameters for your unsupervised machine learning model?,2019-10-04T23:47:39+00:00
836000,"This video provides a quick explanation of unsupervised and supervised machine learning learning approaches, respectively. As the name suggests, supervised requires information from the user in order to train the algorithm and unsupervised works directly with minimal input from the user.

The code from this video is available at: https://github.com/bnsreenu/python_for_microscopists",54 - Unsupervised and supervised machine learning  - a reminder,2019-10-07T20:07:25+00:00
897000,"There are many reasons for instrument manufacturers to invent proprietary file formats for their microscope images. The primary reason is to pack relevant information into their images so you can readily work with them in their respective software packages. 

This makes it difficult, sometimes near impossible, to handle these images outside of their respective software packages. Luckily, a few of these manufacturers share libraries to handle images in other software platforms.  Also, a few good Samaritans develop libraries by working closely with the instrument manufacturers. 

This tutorial explains the process of opening such proprietary files in Python, by using .czi file as an example.

The code from this video is available at: https://github.com/bnsreenu/python_for_microscopists",55 - How to read proprietary microscope images into Python,2019-10-08T23:18:44+00:00
595000,"Feature engineering is an essential part of traditional machine learning. Selecting appropriate features not only speeds up the analysis time but also helps improve your analysis accuracy. This tutorial explains features from an image processing perspective.

The code from this video is available at: https://github.com/bnsreenu/python_for_microscopists",56 - What are features in machine learning?,2019-10-10T22:07:31+00:00
1063000,"Features describe the data you're trying to model. For image processing and machine vision, features can be defined and extracted via digital image filters. This tutorial explains the process of generating features in Python for machine learning purposes.

The code from this video is available at: https://github.com/bnsreenu/python_for_microscopists",57 - How to generate features in Python for machine learning?,2019-10-11T20:25:26+00:00
1559000,"Segmenting your images is an easy task if you can separate regions of interest using histogram (pixel values). But life is not that easy, most scientific images contain regions of interest that require additional information for segmentation. Gabor is a bandpass filter that can be used to extract texture, orientation and other relevant information from your images. This information can then be supplied to your favorite machine learning algorithm. This tutorial explains the basics of Gabor filter, including its implementation in Python.

The code from this video is available at: https://github.com/bnsreenu/python_for_microscopists",58 - What are Gabor filters?,2019-10-14T17:32:32+00:00
